/* First test whether a table's replication set can be properly manipulated */
SELECT * FROM pglogical_regress_variables()
\gset
\c :provider_dsn
CREATE TABLE public.test_publicschema(id serial primary key, data text);
\c :subscriber_dsn
CREATE TABLE public.test_publicschema(data text, id serial primary key);
\c :provider_dsn
SELECT pglogical.replicate_ddl_command($$
CREATE SCHEMA "strange.schema-IS";
CREATE TABLE public.test_nosync(id serial primary key, data text);
CREATE TABLE "strange.schema-IS".test_strangeschema(id serial primary key);
CREATE TABLE "strange.schema-IS".test_diff_repset(id serial primary key, data text DEFAULT '');
$$);
 replicate_ddl_command 
-----------------------
 t
(1 row)

SELECT pg_xlog_wait_remote_apply(pg_current_xlog_location(), 0);
 pg_xlog_wait_remote_apply 
---------------------------
 
(1 row)

-- create some replication sets
SELECT * FROM pglogical.create_replication_set('repset_test');
 create_replication_set 
------------------------
             2154402640
(1 row)

-- move tables to replication set that is not subscribed
SELECT * FROM pglogical.replication_set_add_table('repset_test', 'test_publicschema');
 replication_set_add_table 
---------------------------
 t
(1 row)

SELECT * FROM pglogical.replication_set_add_table('repset_test', 'test_nosync');
 replication_set_add_table 
---------------------------
 t
(1 row)

SELECT * FROM pglogical.replication_set_add_table('repset_test', '"strange.schema-IS".test_strangeschema');
 replication_set_add_table 
---------------------------
 t
(1 row)

SELECT * FROM pglogical.replication_set_add_table('repset_test', '"strange.schema-IS".test_diff_repset');
 replication_set_add_table 
---------------------------
 t
(1 row)

SELECT * FROM pglogical.replication_set_add_all_sequences('repset_test', '{public}');
 replication_set_add_all_sequences 
-----------------------------------
 t
(1 row)

SELECT * FROM pglogical.replication_set_add_sequence('repset_test', pg_get_serial_sequence('"strange.schema-IS".test_strangeschema', 'id'));
 replication_set_add_sequence 
------------------------------
 t
(1 row)

SELECT * FROM pglogical.replication_set_add_sequence('repset_test', pg_get_serial_sequence('"strange.schema-IS".test_diff_repset', 'id'));
 replication_set_add_sequence 
------------------------------
 t
(1 row)

SELECT * FROM pglogical.replication_set_add_all_sequences('default', '{public}');
 replication_set_add_all_sequences 
-----------------------------------
 t
(1 row)

SELECT * FROM pglogical.replication_set_add_sequence('default', pg_get_serial_sequence('"strange.schema-IS".test_strangeschema', 'id'));
 replication_set_add_sequence 
------------------------------
 t
(1 row)

SELECT * FROM pglogical.replication_set_add_sequence('default', pg_get_serial_sequence('"strange.schema-IS".test_diff_repset', 'id'));
 replication_set_add_sequence 
------------------------------
 t
(1 row)

INSERT INTO public.test_publicschema(data) VALUES('a');
INSERT INTO public.test_publicschema(data) VALUES('b');
INSERT INTO public.test_nosync(data) VALUES('a');
INSERT INTO public.test_nosync(data) VALUES('b');
INSERT INTO "strange.schema-IS".test_strangeschema VALUES(DEFAULT);
INSERT INTO "strange.schema-IS".test_strangeschema VALUES(DEFAuLT);
SELECT pg_xlog_wait_remote_apply(pg_current_xlog_location(), 0);
 pg_xlog_wait_remote_apply 
---------------------------
 
(1 row)

\c :subscriber_dsn
SELECT * FROM public.test_publicschema;
 data | id 
------+----
(0 rows)

\c :provider_dsn
-- move tables back to the subscribed replication set
SELECT * FROM pglogical.replication_set_add_table('default', 'test_publicschema', true);
 replication_set_add_table 
---------------------------
 t
(1 row)

SELECT * FROM pglogical.replication_set_add_table('default', 'test_nosync', false);
 replication_set_add_table 
---------------------------
 t
(1 row)

SELECT * FROM pglogical.replication_set_add_table('default', '"strange.schema-IS".test_strangeschema', true);
 replication_set_add_table 
---------------------------
 t
(1 row)

\c :subscriber_dsn
DO $$
-- give it 10 seconds to syncrhonize the tabes
BEGIN
	FOR i IN 1..100 LOOP
		IF (SELECT count(1) FROM pglogical.local_sync_status WHERE sync_status = 'r' AND sync_relname IN ('test_publicschema', 'test_strangeschema')) > 1 THEN
			RETURN;
		END IF;
		PERFORM pg_sleep(0.1);
	END LOOP;
END;
$$;
SELECT sync_kind, sync_subid, sync_nspname, sync_relname, sync_status FROM pglogical.local_sync_status ORDER BY 2,3,4;
 sync_kind | sync_subid |   sync_nspname    |    sync_relname    | sync_status 
-----------+------------+-------------------+--------------------+-------------
 d         | 3848008564 | public            | test_publicschema  | r
 d         | 3848008564 | strange.schema-IS | test_strangeschema | r
 f         | 3848008564 |                   |                    | r
(3 rows)

\c :provider_dsn
SELECT count(1) FROM pg_replication_slots;
 count 
-------
     1
(1 row)

INSERT INTO public.test_publicschema VALUES(3, 'c');
INSERT INTO public.test_publicschema VALUES(4, 'd');
INSERT INTO "strange.schema-IS".test_strangeschema VALUES(3);
INSERT INTO "strange.schema-IS".test_strangeschema VALUES(4);
SELECT pglogical.synchronize_sequence(c.oid)
  FROM pg_class c, pg_namespace n
 WHERE c.relkind = 'S' AND c.relnamespace = n.oid AND n.nspname IN ('public', 'strange.schema-IS');
 synchronize_sequence 
----------------------
 t
 t
 t
 t
 t
(5 rows)

SELECT pg_xlog_wait_remote_apply(pg_current_xlog_location(), 0);
 pg_xlog_wait_remote_apply 
---------------------------
 
(1 row)

\c :subscriber_dsn
SELECT * FROM public.test_publicschema;
 data | id 
------+----
 a    |  1
 b    |  2
 c    |  3
 d    |  4
(4 rows)

SELECT * FROM "strange.schema-IS".test_strangeschema;
 id 
----
  1
  2
  3
  4
(4 rows)

SELECT * FROM pglogical.alter_subscription_synchronize('test_subscription');
 alter_subscription_synchronize 
--------------------------------
 t
(1 row)

DO $$
-- give it 10 seconds to syncrhonize the tabes
BEGIN
	FOR i IN 1..100 LOOP
		IF EXISTS (SELECT 1 FROM pglogical.local_sync_status WHERE sync_status = 'r' AND sync_relname IN ('test_nosync')) THEN
			RETURN;
		END IF;
		PERFORM pg_sleep(0.1);
	END LOOP;
END;
$$;
SELECT sync_kind, sync_subid, sync_nspname, sync_relname, sync_status FROM pglogical.local_sync_status ORDER BY 2,3,4;
 sync_kind | sync_subid |   sync_nspname    |    sync_relname    | sync_status 
-----------+------------+-------------------+--------------------+-------------
 d         | 3848008564 | public            | test_nosync        | r
 d         | 3848008564 | public            | test_publicschema  | r
 d         | 3848008564 | strange.schema-IS | test_strangeschema | r
 f         | 3848008564 |                   |                    | r
(4 rows)

SELECT * FROM public.test_nosync;
 id | data 
----+------
  1 | a
  2 | b
(2 rows)

DELETE FROM public.test_publicschema WHERE id > 1;
SELECT * FROM public.test_publicschema;
 data | id 
------+----
 a    |  1
(1 row)

SELECT * FROM pglogical.alter_subscription_resynchronize_table('test_subscription', 'test_publicschema');
 alter_subscription_resynchronize_table 
----------------------------------------
 t
(1 row)

DO $$
-- give it 10 seconds to syncrhonize the tabes
BEGIN
	FOR i IN 1..100 LOOP
		IF EXISTS (SELECT 1 FROM pglogical.local_sync_status WHERE sync_status = 'r' AND sync_relname IN ('test_publicschema')) THEN
			RETURN;
		END IF;
		PERFORM pg_sleep(0.1);
	END LOOP;
END;
$$;
SELECT sync_kind, sync_subid, sync_nspname, sync_relname, sync_status FROM pglogical.local_sync_status ORDER BY 2,3,4;
 sync_kind | sync_subid |   sync_nspname    |    sync_relname    | sync_status 
-----------+------------+-------------------+--------------------+-------------
 d         | 3848008564 | public            | test_nosync        | r
 d         | 3848008564 | public            | test_publicschema  | r
 d         | 3848008564 | strange.schema-IS | test_strangeschema | r
 f         | 3848008564 |                   |                    | r
(4 rows)

SELECT * FROM public.test_publicschema;
 data | id 
------+----
 a    |  1
 b    |  2
 c    |  3
 d    |  4
(4 rows)

\x
SELECT * FROM pglogical.show_subscription_table('test_subscription', 'test_publicschema');
-[ RECORD 1 ]--------------
nspname | public
relname | test_publicschema
status  | synchronized

\x
BEGIN;
SELECT * FROM pglogical.alter_subscription_add_replication_set('test_subscription', 'repset_test');
 alter_subscription_add_replication_set 
----------------------------------------
 t
(1 row)

SELECT * FROM pglogical.alter_subscription_remove_replication_set('test_subscription', 'default');
 alter_subscription_remove_replication_set 
-------------------------------------------
 t
(1 row)

COMMIT;
DO $$
BEGIN
	FOR i IN 1..100 LOOP
		IF EXISTS (SELECT 1 FROM pglogical.show_subscription_status() WHERE status = 'replicating') THEN
			RETURN;
		END IF;
		PERFORM pg_sleep(0.1);
	END LOOP;
END;
$$;
\c :provider_dsn
SELECT * FROM pglogical.replication_set_remove_table('repset_test', '"strange.schema-IS".test_strangeschema');
 replication_set_remove_table 
------------------------------
 t
(1 row)

INSERT INTO "strange.schema-IS".test_diff_repset VALUES(1);
INSERT INTO "strange.schema-IS".test_diff_repset VALUES(2);
INSERT INTO "strange.schema-IS".test_strangeschema VALUES(5);
INSERT INTO "strange.schema-IS".test_strangeschema VALUES(6);
SELECT pg_xlog_wait_remote_apply(pg_current_xlog_location(), 0);
 pg_xlog_wait_remote_apply 
---------------------------
 
(1 row)

\c :subscriber_dsn
SELECT * FROM "strange.schema-IS".test_diff_repset;
 id | data 
----+------
  1 | 
  2 | 
(2 rows)

SELECT * FROM "strange.schema-IS".test_strangeschema;
 id 
----
  1
  2
  3
  4
(4 rows)

\c :provider_dsn
SELECT * FROM pglogical.alter_replication_set('repset_test', replicate_insert := false, replicate_update := false, replicate_delete := false, replicate_truncate := false);
 alter_replication_set 
-----------------------
            2154402640
(1 row)

INSERT INTO "strange.schema-IS".test_diff_repset VALUES(3);
INSERT INTO "strange.schema-IS".test_diff_repset VALUES(4);
UPDATE "strange.schema-IS".test_diff_repset SET data = 'data';
DELETE FROM "strange.schema-IS".test_diff_repset WHERE id < 3;
TRUNCATE "strange.schema-IS".test_diff_repset;
SELECT pg_xlog_wait_remote_apply(pg_current_xlog_location(), 0);
 pg_xlog_wait_remote_apply 
---------------------------
 
(1 row)

\c :subscriber_dsn
SELECT * FROM "strange.schema-IS".test_diff_repset;
 id | data 
----+------
  3 | data
  4 | data
(2 rows)

\c :provider_dsn
SELECT * FROM pglogical.alter_replication_set('repset_test', replicate_insert := true, replicate_truncate := true);
 alter_replication_set 
-----------------------
            2154402640
(1 row)

INSERT INTO "strange.schema-IS".test_diff_repset VALUES(5);
INSERT INTO "strange.schema-IS".test_diff_repset VALUES(6);
SELECT pg_xlog_wait_remote_apply(pg_current_xlog_location(), 0);
 pg_xlog_wait_remote_apply 
---------------------------
 
(1 row)

\c :subscriber_dsn
SELECT * FROM "strange.schema-IS".test_diff_repset;
 id | data 
----+------
  3 | data
  4 | data
  5 | 
  6 | 
(4 rows)

\c :provider_dsn
TRUNCATE "strange.schema-IS".test_diff_repset;
SELECT pg_xlog_wait_remote_apply(pg_current_xlog_location(), 0);
 pg_xlog_wait_remote_apply 
---------------------------
 
(1 row)

\c :subscriber_dsn
SELECT * FROM "strange.schema-IS".test_diff_repset;
 id | data 
----+------
(0 rows)

SELECT * FROM pglogical.alter_subscription_add_replication_set('test_subscription', 'default');
 alter_subscription_add_replication_set 
----------------------------------------
 t
(1 row)

SELECT N.nspname AS schemaname, C.relname AS tablename, (nextval(C.oid) > 1000) as synced
  FROM pg_class C JOIN pg_namespace N ON (N.oid = C.relnamespace)
 WHERE C.relkind = 'S' AND N.nspname IN ('public', 'strange.schema-IS')
 ORDER BY 1, 2;
    schemaname     |         tablename         | synced 
-------------------+---------------------------+--------
 public            | some_local_seq            | t
 public            | test_nosync_id_seq        | t
 public            | test_publicschema_id_seq  | t
 strange.schema-IS | test_diff_repset_id_seq   | t
 strange.schema-IS | test_strangeschema_id_seq | t
(5 rows)

\c :provider_dsn
DO $$
BEGIN
	FOR i IN 1..100 LOOP
		IF EXISTS (SELECT 1 FROM pg_stat_replication) THEN
			RETURN;
		END IF;
		PERFORM pg_sleep(0.1);
	END LOOP;
END;
$$;
\set VERBOSITY terse
SELECT pglogical.replicate_ddl_command($$
	DROP TABLE public.test_publicschema CASCADE;
	DROP TABLE public.test_nosync CASCADE;
	DROP SCHEMA "strange.schema-IS" CASCADE;
$$);
NOTICE:  drop cascades to 2 other objects
NOTICE:  drop cascades to 2 other objects
NOTICE:  drop cascades to 2 other objects
NOTICE:  drop cascades to 2 other objects
NOTICE:  drop cascades to 2 other objects
NOTICE:  drop cascades to "strange.schema-IS".test_strangeschema membership in replication set default
NOTICE:  drop cascades to 2 other objects
NOTICE:  drop cascades to "strange.schema-IS".test_diff_repset membership in replication set repset_test
NOTICE:  drop cascades to 2 other objects
 replicate_ddl_command 
-----------------------
 t
(1 row)

