/* First test whether a table's replication set can be properly manipulated */
SELECT * FROM pglogical_regress_variables()
\gset
\c :provider_dsn
CREATE TABLE public.test_publicschema(id serial primary key, data text);
\c :subscriber_dsn
CREATE TABLE public.test_publicschema(data text, id serial primary key);
\c :provider_dsn
SELECT pglogical.replicate_ddl_command($$
CREATE SCHEMA "strange.schema-IS";
CREATE TABLE public.test_nosync(id serial primary key, data text);
CREATE TABLE "strange.schema-IS".test_strangeschema(id serial primary key, "S0m3th1ng" timestamptz DEFAULT '1993-01-01 00:00:00 CET');
CREATE TABLE "strange.schema-IS".test_diff_repset(id serial primary key, data text DEFAULT '');
$$);
 replicate_ddl_command 
-----------------------
 t
(1 row)

SELECT pglogical.wait_slot_confirm_lsn(NULL, NULL);
 wait_slot_confirm_lsn 
-----------------------
 
(1 row)

-- create some replication sets
SELECT * FROM pglogical.create_replication_set('repset_test');
 create_replication_set 
------------------------
             2154402640
(1 row)

-- move tables to replication set that is not subscribed
SELECT * FROM pglogical.replication_set_add_table('repset_test', 'test_publicschema');
 replication_set_add_table 
---------------------------
 t
(1 row)

SELECT * FROM pglogical.replication_set_add_table('repset_test', 'test_nosync');
 replication_set_add_table 
---------------------------
 t
(1 row)

SELECT * FROM pglogical.replication_set_add_table('repset_test', '"strange.schema-IS".test_strangeschema');
 replication_set_add_table 
---------------------------
 t
(1 row)

SELECT * FROM pglogical.replication_set_add_table('repset_test', '"strange.schema-IS".test_diff_repset');
 replication_set_add_table 
---------------------------
 t
(1 row)

SELECT * FROM pglogical.replication_set_add_all_sequences('repset_test', '{public}');
 replication_set_add_all_sequences 
-----------------------------------
 t
(1 row)

SELECT * FROM pglogical.replication_set_add_sequence('repset_test', pg_get_serial_sequence('"strange.schema-IS".test_strangeschema', 'id'));
 replication_set_add_sequence 
------------------------------
 t
(1 row)

SELECT * FROM pglogical.replication_set_add_sequence('repset_test', pg_get_serial_sequence('"strange.schema-IS".test_diff_repset', 'id'));
 replication_set_add_sequence 
------------------------------
 t
(1 row)

SELECT * FROM pglogical.replication_set_add_all_sequences('default', '{public}');
 replication_set_add_all_sequences 
-----------------------------------
 t
(1 row)

SELECT * FROM pglogical.replication_set_add_sequence('default', pg_get_serial_sequence('"strange.schema-IS".test_strangeschema', 'id'));
 replication_set_add_sequence 
------------------------------
 t
(1 row)

SELECT * FROM pglogical.replication_set_add_sequence('default', pg_get_serial_sequence('"strange.schema-IS".test_diff_repset', 'id'));
 replication_set_add_sequence 
------------------------------
 t
(1 row)

INSERT INTO public.test_publicschema(data) VALUES('a');
INSERT INTO public.test_publicschema(data) VALUES('b');
INSERT INTO public.test_nosync(data) VALUES('a');
INSERT INTO public.test_nosync(data) VALUES('b');
INSERT INTO "strange.schema-IS".test_strangeschema VALUES(DEFAULT, DEFAULT);
INSERT INTO "strange.schema-IS".test_strangeschema VALUES(DEFAuLT, DEFAULT);
SELECT pglogical.wait_slot_confirm_lsn(NULL, NULL);
 wait_slot_confirm_lsn 
-----------------------
 
(1 row)

\c :subscriber_dsn
SELECT * FROM public.test_publicschema;
 data | id 
------+----
(0 rows)

\c :provider_dsn
-- move tables back to the subscribed replication set
SELECT * FROM pglogical.replication_set_add_table('default', 'test_publicschema', true);
 replication_set_add_table 
---------------------------
 t
(1 row)

SELECT * FROM pglogical.replication_set_add_table('default', 'test_nosync', false);
 replication_set_add_table 
---------------------------
 t
(1 row)

SELECT * FROM pglogical.replication_set_add_table('default', '"strange.schema-IS".test_strangeschema', true);
 replication_set_add_table 
---------------------------
 t
(1 row)

\c :subscriber_dsn
SET statement_timeout = '20s';
SELECT pglogical.wait_for_table_sync_complete('test_subscription', 'test_publicschema');
 wait_for_table_sync_complete 
------------------------------
 
(1 row)

SELECT pglogical.wait_for_table_sync_complete('test_subscription', '"strange.schema-IS".test_strangeschema');
 wait_for_table_sync_complete 
------------------------------
 
(1 row)

RESET statement_timeout;
SELECT sync_kind, sync_subid, sync_nspname, sync_relname, sync_status IN ('y', 'r') FROM pglogical.local_sync_status ORDER BY 2,3,4;
 sync_kind | sync_subid |   sync_nspname    |    sync_relname    | ?column? 
-----------+------------+-------------------+--------------------+----------
 d         | 3848008564 | public            | test_publicschema  | t
 d         | 3848008564 | strange.schema-IS | test_strangeschema | t
 f         | 3848008564 |                   |                    | t
(3 rows)

\c :provider_dsn
DO $$
-- give it 10 seconds to synchronize the tables
BEGIN
	FOR i IN 1..100 LOOP
		IF (SELECT count(1) FROM pg_replication_slots) = 1 THEN
			RETURN;
		END IF;
		PERFORM pg_sleep(0.1);
	END LOOP;
END;
$$;
SELECT count(1) FROM pg_replication_slots;
 count 
-------
     1
(1 row)

INSERT INTO public.test_publicschema VALUES(3, 'c');
INSERT INTO public.test_publicschema VALUES(4, 'd');
INSERT INTO "strange.schema-IS".test_strangeschema VALUES(3, DEFAULT);
INSERT INTO "strange.schema-IS".test_strangeschema VALUES(4, DEFAULT);
SELECT pglogical.synchronize_sequence(c.oid)
  FROM pg_class c, pg_namespace n
 WHERE c.relkind = 'S' AND c.relnamespace = n.oid AND n.nspname IN ('public', 'strange.schema-IS');
 synchronize_sequence 
----------------------
 t
 t
 t
 t
(4 rows)

SELECT pglogical.wait_slot_confirm_lsn(NULL, NULL);
 wait_slot_confirm_lsn 
-----------------------
 
(1 row)

\c :subscriber_dsn
SELECT * FROM public.test_publicschema;
 data | id 
------+----
 a    |  1
 b    |  2
 c    |  3
 d    |  4
(4 rows)

SELECT * FROM "strange.schema-IS".test_strangeschema;
 id |          S0m3th1ng           
----+------------------------------
  1 | Thu Dec 31 15:00:00 1992 PST
  2 | Thu Dec 31 15:00:00 1992 PST
  3 | Thu Dec 31 15:00:00 1992 PST
  4 | Thu Dec 31 15:00:00 1992 PST
(4 rows)

SELECT * FROM pglogical.alter_subscription_synchronize('test_subscription');
 alter_subscription_synchronize 
--------------------------------
 t
(1 row)

BEGIN;
SET statement_timeout = '20s';
SELECT pglogical.wait_for_table_sync_complete('test_subscription', 'test_nosync');
 wait_for_table_sync_complete 
------------------------------
 
(1 row)

COMMIT;
SELECT sync_kind, sync_subid, sync_nspname, sync_relname, sync_status IN ('y', 'r') FROM pglogical.local_sync_status ORDER BY 2,3,4;
 sync_kind | sync_subid |   sync_nspname    |    sync_relname    | ?column? 
-----------+------------+-------------------+--------------------+----------
 d         | 3848008564 | public            | test_nosync        | t
 d         | 3848008564 | public            | test_publicschema  | t
 d         | 3848008564 | strange.schema-IS | test_strangeschema | t
 f         | 3848008564 |                   |                    | t
(4 rows)

SELECT * FROM public.test_nosync;
 id | data 
----+------
  1 | a
  2 | b
(2 rows)

DELETE FROM public.test_publicschema WHERE id > 1;
SELECT * FROM public.test_publicschema;
 data | id 
------+----
 a    |  1
(1 row)

SELECT * FROM pglogical.alter_subscription_resynchronize_table('test_subscription', 'test_publicschema');
 alter_subscription_resynchronize_table 
----------------------------------------
 t
(1 row)

BEGIN;
SET statement_timeout = '20s';
SELECT pglogical.wait_for_table_sync_complete('test_subscription', 'test_publicschema');
 wait_for_table_sync_complete 
------------------------------
 
(1 row)

COMMIT;
SELECT sync_kind, sync_subid, sync_nspname, sync_relname, sync_status IN ('y', 'r') FROM pglogical.local_sync_status ORDER BY 2,3,4;
 sync_kind | sync_subid |   sync_nspname    |    sync_relname    | ?column? 
-----------+------------+-------------------+--------------------+----------
 d         | 3848008564 | public            | test_nosync        | t
 d         | 3848008564 | public            | test_publicschema  | t
 d         | 3848008564 | strange.schema-IS | test_strangeschema | t
 f         | 3848008564 |                   |                    | t
(4 rows)

SELECT * FROM public.test_publicschema;
 data | id 
------+----
 a    |  1
 b    |  2
 c    |  3
 d    |  4
(4 rows)

\x
SELECT nspname, relname, status IN ('synchronized', 'replicating') FROM pglogical.show_subscription_table('test_subscription', 'test_publicschema');
-[ RECORD 1 ]---------------
nspname  | public
relname  | test_publicschema
?column? | t

\x
BEGIN;
SELECT * FROM pglogical.alter_subscription_add_replication_set('test_subscription', 'repset_test');
 alter_subscription_add_replication_set 
----------------------------------------
 t
(1 row)

SELECT * FROM pglogical.alter_subscription_remove_replication_set('test_subscription', 'default');
 alter_subscription_remove_replication_set 
-------------------------------------------
 t
(1 row)

COMMIT;
DO $$
BEGIN
	FOR i IN 1..100 LOOP
		IF EXISTS (SELECT 1 FROM pglogical.show_subscription_status() WHERE status = 'replicating') THEN
			RETURN;
		END IF;
		PERFORM pg_sleep(0.1);
	END LOOP;
END;
$$;
\c :provider_dsn
SELECT * FROM pglogical.replication_set_remove_table('repset_test', '"strange.schema-IS".test_strangeschema');
 replication_set_remove_table 
------------------------------
 t
(1 row)

INSERT INTO "strange.schema-IS".test_diff_repset VALUES(1);
INSERT INTO "strange.schema-IS".test_diff_repset VALUES(2);
INSERT INTO "strange.schema-IS".test_strangeschema VALUES(5, DEFAULT);
INSERT INTO "strange.schema-IS".test_strangeschema VALUES(6, DEFAULT);
SELECT pglogical.wait_slot_confirm_lsn(NULL, NULL);
 wait_slot_confirm_lsn 
-----------------------
 
(1 row)

\c :subscriber_dsn
SELECT * FROM "strange.schema-IS".test_diff_repset;
 id | data 
----+------
  1 | 
  2 | 
(2 rows)

SELECT * FROM "strange.schema-IS".test_strangeschema;
 id |          S0m3th1ng           
----+------------------------------
  1 | Thu Dec 31 15:00:00 1992 PST
  2 | Thu Dec 31 15:00:00 1992 PST
  3 | Thu Dec 31 15:00:00 1992 PST
  4 | Thu Dec 31 15:00:00 1992 PST
(4 rows)

\c :provider_dsn
SELECT * FROM pglogical.alter_replication_set('repset_test', replicate_insert := false, replicate_update := false, replicate_delete := false, replicate_truncate := false);
 alter_replication_set 
-----------------------
            2154402640
(1 row)

INSERT INTO "strange.schema-IS".test_diff_repset VALUES(3);
INSERT INTO "strange.schema-IS".test_diff_repset VALUES(4);
UPDATE "strange.schema-IS".test_diff_repset SET data = 'data';
DELETE FROM "strange.schema-IS".test_diff_repset WHERE id < 3;
TRUNCATE "strange.schema-IS".test_diff_repset;
SELECT pglogical.wait_slot_confirm_lsn(NULL, NULL);
 wait_slot_confirm_lsn 
-----------------------
 
(1 row)

\c :subscriber_dsn
SELECT * FROM "strange.schema-IS".test_diff_repset;
 id | data 
----+------
  3 | data
  4 | data
(2 rows)

\c :provider_dsn
SELECT * FROM pglogical.alter_replication_set('repset_test', replicate_insert := true, replicate_truncate := true);
 alter_replication_set 
-----------------------
            2154402640
(1 row)

INSERT INTO "strange.schema-IS".test_diff_repset VALUES(5);
INSERT INTO "strange.schema-IS".test_diff_repset VALUES(6);
SELECT pglogical.wait_slot_confirm_lsn(NULL, NULL);
 wait_slot_confirm_lsn 
-----------------------
 
(1 row)

\c :subscriber_dsn
SELECT * FROM "strange.schema-IS".test_diff_repset;
 id | data 
----+------
  3 | data
  4 | data
  5 | 
  6 | 
(4 rows)

\c :provider_dsn
TRUNCATE "strange.schema-IS".test_diff_repset;
SELECT pglogical.wait_slot_confirm_lsn(NULL, NULL);
 wait_slot_confirm_lsn 
-----------------------
 
(1 row)

\c :subscriber_dsn
SELECT * FROM "strange.schema-IS".test_diff_repset;
 id | data 
----+------
(0 rows)

SELECT * FROM pglogical.alter_subscription_add_replication_set('test_subscription', 'default');
 alter_subscription_add_replication_set 
----------------------------------------
 t
(1 row)

DO $$
BEGIN
	FOR i IN 1..100 LOOP
		IF EXISTS (SELECT 1 FROM pglogical.show_subscription_status() WHERE status = 'replicating') THEN
			RETURN;
		END IF;
		PERFORM pg_sleep(0.1);
	END LOOP;
END;
$$;
SELECT N.nspname AS schemaname, C.relname AS tablename, (nextval(C.oid) > 1000) as synced
  FROM pg_class C JOIN pg_namespace N ON (N.oid = C.relnamespace)
 WHERE C.relkind = 'S' AND N.nspname IN ('public', 'strange.schema-IS')
 ORDER BY 1, 2;
    schemaname     |         tablename         | synced 
-------------------+---------------------------+--------
 public            | test_nosync_id_seq        | t
 public            | test_publicschema_id_seq  | t
 strange.schema-IS | test_diff_repset_id_seq   | t
 strange.schema-IS | test_strangeschema_id_seq | t
(4 rows)

\c :provider_dsn
DO $$
BEGIN
	FOR i IN 1..100 LOOP
		IF EXISTS (SELECT 1 FROM pg_stat_replication) THEN
			RETURN;
		END IF;
		PERFORM pg_sleep(0.1);
	END LOOP;
END;
$$;
\set VERBOSITY terse
SELECT pglogical.replicate_ddl_command($$
	DROP TABLE public.test_publicschema CASCADE;
	DROP TABLE public.test_nosync CASCADE;
	DROP SCHEMA "strange.schema-IS" CASCADE;
$$);
NOTICE:  drop cascades to 2 other objects
NOTICE:  drop cascades to 2 other objects
NOTICE:  drop cascades to 2 other objects
NOTICE:  drop cascades to 2 other objects
NOTICE:  drop cascades to 2 other objects
NOTICE:  drop cascades to 2 other objects
NOTICE:  drop cascades to table "strange.schema-IS".test_diff_repset membership in replication set repset_test
NOTICE:  drop cascades to 2 other objects
NOTICE:  drop cascades to table "strange.schema-IS".test_strangeschema membership in replication set default
 replicate_ddl_command 
-----------------------
 t
(1 row)

SELECT pglogical.replicate_ddl_command($$
	CREATE TABLE public.synctest(a int primary key, b text);
$$);
 replicate_ddl_command 
-----------------------
 t
(1 row)

SELECT * FROM pglogical.replication_set_add_table('repset_test', 'synctest', synchronize_data := false);
 replication_set_add_table 
---------------------------
 t
(1 row)

INSERT INTO synctest VALUES (1, '1');
-- no way to see if this worked currently, but if one can manually check
-- if there is conflict in log or not (conflict = bad here)
SELECT pglogical.replicate_ddl_command($$
	SELECT pg_sleep(5);
	UPDATE public.synctest SET b = md5(a::text);
$$);
 replicate_ddl_command 
-----------------------
 t
(1 row)

INSERT INTO synctest VALUES (2, '2');
\c :subscriber_dsn
SELECT * FROM pglogical.alter_subscription_resynchronize_table('test_subscription', 'synctest');
 alter_subscription_resynchronize_table 
----------------------------------------
 t
(1 row)

BEGIN;
SET statement_timeout = '20s';
SELECT pglogical.wait_for_table_sync_complete('test_subscription', 'synctest');
 wait_for_table_sync_complete 
------------------------------
 
(1 row)

COMMIT;
\c :provider_dsn
SELECT pglogical.wait_slot_confirm_lsn(NULL, NULL);
 wait_slot_confirm_lsn 
-----------------------
 
(1 row)

SELECT * FROM synctest;
 a |                b                 
---+----------------------------------
 1 | c4ca4238a0b923820dcc509a6f75849b
 2 | 2
(2 rows)

\c :subscriber_dsn
SELECT * FROM synctest;
 a |                b                 
---+----------------------------------
 1 | c4ca4238a0b923820dcc509a6f75849b
 2 | 2
(2 rows)

\c :provider_dsn
\set VERBOSITY terse
SELECT pglogical.replicate_ddl_command($$
	DROP TABLE public.synctest CASCADE;
$$);
NOTICE:  drop cascades to table public.synctest membership in replication set repset_test
 replicate_ddl_command 
-----------------------
 t
(1 row)

\c :subscriber_dsn
-- this is to reorder repsets to default order
BEGIN;
SELECT * FROM pglogical.alter_subscription_remove_replication_set('test_subscription', 'default');
 alter_subscription_remove_replication_set 
-------------------------------------------
 t
(1 row)

SELECT * FROM pglogical.alter_subscription_remove_replication_set('test_subscription', 'ddl_sql');
 alter_subscription_remove_replication_set 
-------------------------------------------
 t
(1 row)

SELECT * FROM pglogical.alter_subscription_remove_replication_set('test_subscription', 'default_insert_only');
 alter_subscription_remove_replication_set 
-------------------------------------------
 t
(1 row)

SELECT * FROM pglogical.alter_subscription_remove_replication_set('test_subscription', 'repset_test');
 alter_subscription_remove_replication_set 
-------------------------------------------
 t
(1 row)

SELECT * FROM pglogical.alter_subscription_add_replication_set('test_subscription', 'default');
 alter_subscription_add_replication_set 
----------------------------------------
 t
(1 row)

SELECT * FROM pglogical.alter_subscription_add_replication_set('test_subscription', 'default_insert_only');
 alter_subscription_add_replication_set 
----------------------------------------
 t
(1 row)

SELECT * FROM pglogical.alter_subscription_add_replication_set('test_subscription', 'ddl_sql');
 alter_subscription_add_replication_set 
----------------------------------------
 t
(1 row)

COMMIT;
