-- basic builtin datatypes
SELECT * FROM pglogical_regress_variables()
\gset
\c :provider_dsn
SELECT pglogical.replicate_ddl_command($$
	CREATE TABLE public.basic_dml (
		id serial primary key,
		other integer,
		data text,
		something interval
	);
$$);
 replicate_ddl_command 
-----------------------
 t
(1 row)

SELECT * FROM pglogical.replication_set_add_table('default', 'basic_dml');
 replication_set_add_table 
---------------------------
 t
(1 row)

SELECT pglogical.wait_slot_confirm_lsn(NULL, NULL);
 wait_slot_confirm_lsn 
-----------------------
 
(1 row)

\c :subscriber_dsn
ALTER TABLE public.basic_dml ADD COLUMN subonly integer;
ALTER TABLE public.basic_dml ADD COLUMN subonly_def integer DEFAULT 99;
\c :provider_dsn
-- check basic insert replication
INSERT INTO basic_dml(other, data, something)
VALUES (5, 'foo', '1 minute'::interval),
       (4, 'bar', '12 weeks'::interval),
       (3, 'baz', '2 years 1 hour'::interval),
       (2, 'qux', '8 months 2 days'::interval),
       (1, NULL, NULL);
SELECT pglogical.wait_slot_confirm_lsn(NULL, NULL);
 wait_slot_confirm_lsn 
-----------------------
 
(1 row)

\c :subscriber_dsn
SELECT id, other, data, something, subonly, subonly_def FROM basic_dml ORDER BY id;
 id | other | data |    something     | subonly | subonly_def 
----+-------+------+------------------+---------+-------------
  1 |     5 | foo  | @ 1 min          |         |          99
  2 |     4 | bar  | @ 84 days        |         |          99
  3 |     3 | baz  | @ 2 years 1 hour |         |          99
  4 |     2 | qux  | @ 8 mons 2 days  |         |          99
  5 |     1 |      |                  |         |          99
(5 rows)

-- update one row
\c :provider_dsn
UPDATE basic_dml SET other = '4', data = NULL, something = '3 days'::interval WHERE id = 4;
SELECT pglogical.wait_slot_confirm_lsn(NULL, NULL);
 wait_slot_confirm_lsn 
-----------------------
 
(1 row)

\c :subscriber_dsn
SELECT id, other, data, something FROM basic_dml ORDER BY id;
 id | other | data |    something     
----+-------+------+------------------
  1 |     5 | foo  | @ 1 min
  2 |     4 | bar  | @ 84 days
  3 |     3 | baz  | @ 2 years 1 hour
  4 |     4 |      | @ 3 days
  5 |     1 |      | 
(5 rows)

-- update multiple rows
\c :provider_dsn
UPDATE basic_dml SET other = id, data = data || id::text;
SELECT pglogical.wait_slot_confirm_lsn(NULL, NULL);
 wait_slot_confirm_lsn 
-----------------------
 
(1 row)

\c :subscriber_dsn
SELECT id, other, data, something FROM basic_dml ORDER BY id;
 id | other | data |    something     
----+-------+------+------------------
  1 |     1 | foo1 | @ 1 min
  2 |     2 | bar2 | @ 84 days
  3 |     3 | baz3 | @ 2 years 1 hour
  4 |     4 |      | @ 3 days
  5 |     5 |      | 
(5 rows)

\c :provider_dsn
UPDATE basic_dml SET other = id, something = something - '10 seconds'::interval WHERE id < 3;
UPDATE basic_dml SET other = id, something = something + '10 seconds'::interval WHERE id > 3;
SELECT pglogical.wait_slot_confirm_lsn(NULL, NULL);
 wait_slot_confirm_lsn 
-----------------------
 
(1 row)

\c :subscriber_dsn
SELECT id, other, data, something, subonly, subonly_def FROM basic_dml ORDER BY id;
 id | other | data |     something      | subonly | subonly_def 
----+-------+------+--------------------+---------+-------------
  1 |     1 | foo1 | @ 50 secs          |         |          99
  2 |     2 | bar2 | @ 84 days -10 secs |         |          99
  3 |     3 | baz3 | @ 2 years 1 hour   |         |          99
  4 |     4 |      | @ 3 days 10 secs   |         |          99
  5 |     5 |      |                    |         |          99
(5 rows)

-- delete one row
\c :provider_dsn
DELETE FROM basic_dml WHERE id = 2;
SELECT pglogical.wait_slot_confirm_lsn(NULL, NULL);
 wait_slot_confirm_lsn 
-----------------------
 
(1 row)

\c :subscriber_dsn
SELECT id, other, data, something FROM basic_dml ORDER BY id;
 id | other | data |    something     
----+-------+------+------------------
  1 |     1 | foo1 | @ 50 secs
  3 |     3 | baz3 | @ 2 years 1 hour
  4 |     4 |      | @ 3 days 10 secs
  5 |     5 |      | 
(4 rows)

-- delete multiple rows
\c :provider_dsn
DELETE FROM basic_dml WHERE id < 4;
SELECT pglogical.wait_slot_confirm_lsn(NULL, NULL);
 wait_slot_confirm_lsn 
-----------------------
 
(1 row)

\c :subscriber_dsn
SELECT id, other, data, something FROM basic_dml ORDER BY id;
 id | other | data |    something     
----+-------+------+------------------
  4 |     4 |      | @ 3 days 10 secs
  5 |     5 |      | 
(2 rows)

-- truncate
\c :provider_dsn
TRUNCATE basic_dml;
SELECT pglogical.wait_slot_confirm_lsn(NULL, NULL);
 wait_slot_confirm_lsn 
-----------------------
 
(1 row)

\c :subscriber_dsn
SELECT id, other, data, something FROM basic_dml ORDER BY id;
 id | other | data | something 
----+-------+------+-----------
(0 rows)

-- copy
\c :provider_dsn
\COPY basic_dml FROM STDIN WITH CSV
SELECT pglogical.wait_slot_confirm_lsn(NULL, NULL);
 wait_slot_confirm_lsn 
-----------------------
 
(1 row)

\c :subscriber_dsn
SELECT id, other, data, something FROM basic_dml ORDER BY id;
  id  | other | data | something 
------+-------+------+-----------
 9000 |     1 | aaa  | @ 1 hour
 9001 |     2 | bbb  | @ 2 years
 9002 |     3 | ccc  | @ 3 mins
 9003 |     4 | ddd  | @ 4 days
(4 rows)

\c :provider_dsn
\set VERBOSITY terse
SELECT pglogical.replicate_ddl_command($$
	DROP TABLE public.basic_dml CASCADE;
$$);
NOTICE:  drop cascades to table public.basic_dml membership in replication set default
 replicate_ddl_command 
-----------------------
 t
(1 row)

