SELECT * FROM pglogical_regress_variables()
\gset
/*
Covered cases:

  - 1 table replicated with a distinct name in a distinct schema. Init + DML + resync + TRUNCATE
  - 1 table replicated with a distinct name in the same schema. Init + DML + resync + TRUNCATE
  - 1 table replicated with the same name in a distinct schema. Init + DML + resync + TRUNCATE
  - 1 table replicated with distinct target in 2 distinct sets (a.b -> c.d and a.b -> e.f)
  - 2 tables merged from distinct sets
  - test resynchronize when multiple origin for the same table (origin indistincts sets

  - Not supported: 2 tables merged in the same set
  - Trying to add twice the same table in the same set (with distinct targets): FORBIDEN (XXX should/can we allow ?)
*/
\c :provider_dsn
CREATE SCHEMA "provider.ping";
CREATE SCHEMA "provider2.ping2";
CREATE SCHEMA provsub;
CREATE TABLE "provider.ping".test_origin(id serial primary key, data text DEFAULT '');
INSERT INTO "provider.ping".test_origin(data) VALUES ('a');
INSERT INTO "provider.ping".test_origin(data) VALUES ('b');
SELECT * FROM "provider.ping".test_origin ORDER by 1;
 id | data 
----+------
  1 | a
  2 | b
(2 rows)

CREATE TABLE "provider.ping".test_origin2(id serial primary key, data text DEFAULT '');
INSERT INTO "provider.ping".test_origin2(data) VALUES ('y');
INSERT INTO "provider.ping".test_origin2(data) VALUES ('z');
SELECT * FROM "provider.ping".test_origin2 ORDER by 1;
 id | data 
----+------
  1 | y
  2 | z
(2 rows)

CREATE TABLE provsub.test_origin3(id serial primary key, data text DEFAULT '');
INSERT INTO provsub.test_origin3(data) VALUES ('a');
INSERT INTO provsub.test_origin3(data) VALUES ('b');
SELECT * FROM provsub.test_origin3 ORDER by 1;
 id | data 
----+------
  1 | a
  2 | b
(2 rows)

CREATE TABLE "provider.ping".provsub(id serial primary key, data text DEFAULT '');
INSERT INTO "provider.ping".provsub(data) VALUES ('a');
INSERT INTO "provider.ping".provsub(data) VALUES ('b');
SELECT * FROM "provider.ping".provsub ORDER by 1;
 id | data 
----+------
  1 | a
  2 | b
(2 rows)

CREATE TABLE "provider.ping".bad(id serial primary key, data text DEFAULT '');
\c :subscriber_dsn
CREATE SCHEMA "subscriber.pong";
CREATE SCHEMA "subscriber2.pong2";
CREATE SCHEMA provsub;
CREATE TABLE "subscriber.pong".test_target(id serial primary key, data text DEFAULT '');
CREATE TABLE "subscriber2.pong2".test_target2(id serial primary key, data text DEFAULT '');
CREATE TABLE provsub.test_target3(id serial primary key, data text DEFAULT '');
CREATE TABLE "subscriber.pong".provsub(id serial primary key, data text DEFAULT '');
-- test replication with initial copy
-- add table and sequence to the subscribed replication set
\c :provider_dsn
SELECT * FROM pglogical.create_replication_set('map1',
       replicate_insert:=true,
       replicate_update:=true,
       replicate_delete:=true,
      replicate_truncate:=true);
 create_replication_set 
------------------------
             2047405990
(1 row)

-- distinct name and schema
SELECT * FROM pglogical.replication_set_add_table('map1', '"provider.ping".test_origin', true, nsptarget:='subscriber.pong', reltarget:='test_target');
 replication_set_add_table 
---------------------------
 t
(1 row)

SELECT * FROM pglogical.replication_set_add_sequence('map1', pg_get_serial_sequence('"provider.ping".test_origin', 'id'), nsptarget:='subscriber.pong',  reltarget:='test_target_id_seq'); -- XXX not  a dynamic name ...
 replication_set_add_sequence 
------------------------------
 t
(1 row)

-- distinct name, same schema
SELECT * FROM pglogical.replication_set_add_table('map1', 'provsub.test_origin3', true, reltarget:='test_target3');
 replication_set_add_table 
---------------------------
 t
(1 row)

SELECT * FROM pglogical.replication_set_add_sequence('map1', pg_get_serial_sequence('provsub.test_origin3', 'id'), reltarget:='test_target3_id_seq'); -- XXX not  a dynamic name ...
 replication_set_add_sequence 
------------------------------
 t
(1 row)

-- same name, distinct schema
SELECT * FROM pglogical.replication_set_add_table('map1', '"provider.ping".provsub', true, nsptarget:='subscriber.pong');
 replication_set_add_table 
---------------------------
 t
(1 row)

SELECT * FROM pglogical.replication_set_add_sequence('map1', pg_get_serial_sequence('"provider.ping".provsub', 'id'), nsptarget:='subscriber.pong');
 replication_set_add_sequence 
------------------------------
 t
(1 row)

SELECT pglogical.wait_slot_confirm_lsn(NULL, NULL);
 wait_slot_confirm_lsn 
-----------------------
 
(1 row)

SELECT * FROM pglogical.replication_set_seq order by 1,2;
   set_id   |             set_seqoid             |  set_nsptarget  |    set_seqtarget    
------------+------------------------------------+-----------------+---------------------
 2047405990 | "provider.ping".test_origin_id_seq | subscriber.pong | test_target_id_seq
 2047405990 | provsub.test_origin3_id_seq        | provsub         | test_target3_id_seq
 2047405990 | "provider.ping".provsub_id_seq     | subscriber.pong | provsub_id_seq
(3 rows)

SELECT * FROM pglogical.replication_set_table order by 1,2;
   set_id   |         set_reloid          | set_att_list | set_row_filter |  set_nsptarget  | set_reltarget 
------------+-----------------------------+--------------+----------------+-----------------+---------------
 2047405990 | "provider.ping".test_origin |              |                | subscriber.pong | test_target
 2047405990 | provsub.test_origin3        |              |                | provsub         | test_target3
 2047405990 | "provider.ping".provsub     |              |                | subscriber.pong | provsub
(3 rows)

\c :subscriber_dsn
-- init
SELECT * FROM pglogical.create_subscription(
    subscription_name := 'sub_map1',
    provider_dsn := (SELECT provider_dsn FROM pglogical_regress_variables()) || ' user=super',
	synchronize_structure := 'none',
	forward_origins := '{}',
        replication_sets := '{map1}');
 create_subscription 
---------------------
          2754255463
(1 row)

SELECT pglogical.wait_for_subscription_sync_complete('sub_map1');
 wait_for_subscription_sync_complete 
-------------------------------------
 
(1 row)

SELECT * FROM "subscriber.pong".test_target;
 id | data 
----+------
  1 | a
  2 | b
(2 rows)

SELECT * FROM provsub.test_target3;
 id | data 
----+------
  1 | a
  2 | b
(2 rows)

SELECT * FROM "subscriber.pong".provsub;
 id | data 
----+------
  1 | a
  2 | b
(2 rows)

-- test resynchronize
\c :subscriber_dsn
DELETE FROM "subscriber.pong".test_target WHERE id > 1;
DELETE FROM provsub.test_target3 WHERE id > 1;
DELETE FROM "subscriber.pong".provsub WHERE id > 1;
SELECT * FROM pglogical.alter_subscription_resynchronize_table('sub_map1', '"subscriber.pong".test_target', true);
 alter_subscription_resynchronize_table 
----------------------------------------
 t
(1 row)

SELECT * FROM pglogical.alter_subscription_resynchronize_table('sub_map1', 'provsub.test_target3', true);
 alter_subscription_resynchronize_table 
----------------------------------------
 t
(1 row)

SELECT * FROM pglogical.alter_subscription_resynchronize_table('sub_map1', '"subscriber.pong".provsub', true);
 alter_subscription_resynchronize_table 
----------------------------------------
 t
(1 row)

SELECT pglogical.wait_for_table_sync_complete('sub_map1', '"subscriber.pong".test_target');
 wait_for_table_sync_complete 
------------------------------
 
(1 row)

SELECT pglogical.wait_for_table_sync_complete('sub_map1', 'provsub.test_target3');
 wait_for_table_sync_complete 
------------------------------
 
(1 row)

SELECT pglogical.wait_for_table_sync_complete('sub_map1', '"subscriber.pong".provsub');
 wait_for_table_sync_complete 
------------------------------
 
(1 row)

SELECT * FROM "subscriber.pong".test_target;
 id | data 
----+------
  1 | a
  2 | b
(2 rows)

SELECT * FROM provsub.test_target3;
 id | data 
----+------
  1 | a
  2 | b
(2 rows)

SELECT * FROM "subscriber.pong".provsub;
 id | data 
----+------
  1 | a
  2 | b
(2 rows)

-- test synchronize
\c :subscriber_dsn
CREATE TABLE "subscriber.pong".test_synchronize(id serial primary key, data text DEFAULT '');
\c :provider_dsn
CREATE TABLE "provider.ping".test_synchronize(id serial primary key, data text DEFAULT '');
INSERT INTO "provider.ping".test_synchronize(data) VALUES ('a');
SELECT * FROM pglogical.replication_set_add_table('map1', '"provider.ping".test_synchronize', true, nsptarget:='subscriber.pong');
 replication_set_add_table 
---------------------------
 t
(1 row)

SELECT * FROM pglogical.replication_set_add_sequence('map1', pg_get_serial_sequence('"provider.ping".test_synchronize', 'id'), nsptarget:='subscriber.pong'); -- XXX not  a dynamic name ...
 replication_set_add_sequence 
------------------------------
 t
(1 row)

\c :subscriber_dsn
SELECT * FROM pglogical.alter_subscription_synchronize('sub_map1');
 alter_subscription_synchronize 
--------------------------------
 t
(1 row)

SELECT pglogical.wait_for_table_sync_complete('sub_map1', '"subscriber.pong".test_synchronize');
 wait_for_table_sync_complete 
------------------------------
 
(1 row)

SELECT * FROM "subscriber.pong".test_synchronize;
 id | data 
----+------
  1 | a
(1 row)

-- test DML replication after init
\c :provider_dsn
INSERT INTO "provider.ping".test_origin(data) VALUES ('c');
INSERT INTO "provider.ping".test_origin(data) VALUES ('d');
UPDATE "provider.ping".test_origin SET data = 'data';
DELETE FROM "provider.ping".test_origin WHERE id < 3;
INSERT INTO provsub.test_origin3(data) VALUES ('c');
INSERT INTO provsub.test_origin3(data) VALUES ('d');
UPDATE provsub.test_origin3 SET data = 'data';
DELETE FROM provsub.test_origin3 WHERE id < 3;
INSERT INTO "provider.ping".provsub(data) VALUES ('c');
INSERT INTO "provider.ping".provsub(data) VALUES ('d');
UPDATE "provider.ping".provsub SET data = 'data';
DELETE FROM "provider.ping".provsub WHERE id < 3;
SELECT pglogical.wait_slot_confirm_lsn(NULL, NULL);
 wait_slot_confirm_lsn 
-----------------------
 
(1 row)

\c :subscriber_dsn
SELECT * FROM "subscriber.pong".test_target;
 id | data 
----+------
  3 | data
  4 | data
(2 rows)

SELECT * FROM provsub.test_target3;
 id | data 
----+------
  3 | data
  4 | data
(2 rows)

SELECT * FROM "subscriber.pong".provsub;
 id | data 
----+------
  3 | data
  4 | data
(2 rows)

-- truncate
\c :provider_dsn
TRUNCATE "provider.ping".test_origin;
TRUNCATE provsub.test_origin3;
TRUNCATE "provider.ping".provsub;
SELECT pglogical.wait_slot_confirm_lsn(NULL, NULL);
 wait_slot_confirm_lsn 
-----------------------
 
(1 row)

\c :subscriber_dsn
SELECT * FROM "subscriber.pong".test_target;
 id | data 
----+------
(0 rows)

SELECT * FROM provsub.test_target3;
 id | data 
----+------
(0 rows)

SELECT * FROM "subscriber.pong".provsub;
 id | data 
----+------
(0 rows)

-- Merging tables
-- test merge data from 2 tables into 1 in distinct sets
\c :subscriber_dsn
CREATE TABLE "subscriber.pong".test_merge(id serial primary key, data text DEFAULT '');
\c :provider_dsn
CREATE TABLE "provider.ping".test_merge(id serial primary key, data text DEFAULT '');
INSERT INTO "provider.ping".test_merge(id,data) VALUES (9, 'm');
INSERT INTO "provider.ping".test_origin(data) VALUES ('n');
SELECT * FROM "provider.ping".test_merge ORDER by 1;
 id | data 
----+------
  9 | m
(1 row)

SELECT * FROM "provider.ping".test_origin ORDER by 1;
 id | data 
----+------
  5 | n
(1 row)

SELECT * FROM pglogical.create_replication_set('map2',
       replicate_insert:=true,
       replicate_update:=true,
       replicate_delete:=true,
       replicate_truncate:=true);
 create_replication_set 
------------------------
             1072520286
(1 row)

SELECT * FROM pglogical.replication_set_add_table('map2', '"provider.ping".test_merge', true, nsptarget:='subscriber.pong', reltarget:='test_target');
 replication_set_add_table 
---------------------------
 t
(1 row)

SELECT pglogical.wait_slot_confirm_lsn(NULL, NULL);
 wait_slot_confirm_lsn 
-----------------------
 
(1 row)

\c :subscriber_dsn
SELECT * FROM "subscriber.pong".test_target;
 id | data 
----+------
  5 | n
(1 row)

SELECT * FROM pglogical.create_subscription(
    subscription_name := 'sub_map2',
    provider_dsn := (SELECT provider_dsn FROM pglogical_regress_variables()) || ' user=super',
	synchronize_structure := 'none',
	forward_origins := '{}',
        replication_sets := '{map2}');
 create_subscription 
---------------------
          4241919301
(1 row)

SELECT pglogical.wait_for_subscription_sync_complete('sub_map2');
 wait_for_subscription_sync_complete 
-------------------------------------
 
(1 row)

SELECT * FROM "subscriber.pong".test_target;
 id | data 
----+------
  5 | n
  9 | m
(2 rows)

TRUNCATE  "subscriber.pong".test_target;
-- test resynchronize when multiple origin for the same table (origin indistincts sets
SELECT * FROM pglogical.alter_subscription_resynchronize_table('sub_map1', '"subscriber.pong".test_target', true);
 alter_subscription_resynchronize_table 
----------------------------------------
 t
(1 row)

SELECT pglogical.wait_for_table_sync_complete('sub_map1', '"subscriber.pong".test_target');
 wait_for_table_sync_complete 
------------------------------
 
(1 row)

SELECT * FROM pglogical.alter_subscription_resynchronize_table('sub_map2', '"subscriber.pong".test_target', false);
 alter_subscription_resynchronize_table 
----------------------------------------
 t
(1 row)

SELECT pglogical.wait_for_table_sync_complete('sub_map2', '"subscriber.pong".test_target');
 wait_for_table_sync_complete 
------------------------------
 
(1 row)

SELECT * FROM "subscriber.pong".test_target;
 id | data 
----+------
  5 | n
  9 | m
(2 rows)

-- Splitting
-- 1 table replicated with distinct target in 2 distinct sets (a.b -> c.d and a.b -> e.f)
\c :provider_dsn
SELECT * FROM pglogical.replication_set_add_table('map2', '"provider.ping".test_origin', true, nsptarget:='subscriber2.pong2', reltarget:='test_target2');
 replication_set_add_table 
---------------------------
 t
(1 row)

SELECT * FROM pglogical.replication_set_add_sequence('map2', pg_get_serial_sequence('"provider.ping".test_origin', 'id'), nsptarget:='subscriber2.pong2',  reltarget:='test_target2_id_seq'); -- XXX not  a dynamic name ...
 replication_set_add_sequence 
------------------------------
 t
(1 row)

SELECT pglogical.wait_slot_confirm_lsn(NULL, NULL);
 wait_slot_confirm_lsn 
-----------------------
 
(1 row)

\c :subscriber_dsn
SELECT pglogical.wait_for_subscription_sync_complete('sub_map2');
 wait_for_subscription_sync_complete 
-------------------------------------
 
(1 row)

SELECT * FROM "subscriber2.pong2".test_target2;
 id | data 
----+------
  5 | n
(1 row)

-- Not supported cases:
-- test merging 2 sequences to the same target: not allowed !
\c :provider_dsn
-- same set
SELECT * FROM pglogical.replication_set_add_sequence('map1', pg_get_serial_sequence('"provider.ping".bad', 'id'), nsptarget:='subscriber.pong',  reltarget:='test_target_id_seq'); -- XXX not  a dynamic name ...
ERROR:  Sequence subscriber.pong.test_target_id_seq already replicated from provider.ping.bad_id_seq, cannot add another source
-- distinct set
SELECT * FROM pglogical.replication_set_add_sequence('map2', pg_get_serial_sequence('"provider.ping".bad', 'id'), nsptarget:='subscriber.pong',  reltarget:='test_target_id_seq'); -- XXX not  a dynamic name ...
ERROR:  Sequence subscriber.pong.test_target_id_seq already replicated from provider.ping.bad_id_seq, cannot add another source
DROP TABLE "provider.ping".bad;
-- Merging tables
-- test merge data from 2 tables into 1 in the same set: not allowed
\c :provider_dsn
SELECT * FROM pglogical.replication_set_add_table('map1', '"provider.ping".test_origin2', true, nsptarget:='subscriber.pong', reltarget:='test_target');
ERROR:  Table subscriber.pong.test_target already replicated from provider.ping.test_origin2 in the same set, cannot add another source
-- XXX copy test required ?
-- synchronize sequences
\c :provider_dsn
SELECT pglogical.synchronize_sequence('"provider.ping".test_origin_id_seq');
 synchronize_sequence 
----------------------
 t
(1 row)

SELECT pglogical.synchronize_sequence('provsub.test_origin3_id_seq');
 synchronize_sequence 
----------------------
 t
(1 row)

SELECT pglogical.synchronize_sequence('"provider.ping".provsub_id_seq');
 synchronize_sequence 
----------------------
 t
(1 row)

SELECT pglogical.synchronize_sequence('"provider.ping".test_synchronize_id_seq');
 synchronize_sequence 
----------------------
 t
(1 row)

SELECT pglogical.wait_slot_confirm_lsn(NULL, NULL);
 wait_slot_confirm_lsn 
-----------------------
 
(1 row)

\c :subscriber_dsn
SELECT N.nspname AS schemaname, C.relname AS tablename, (nextval(C.oid) > 1000) as synced
  FROM pg_class C JOIN pg_namespace N ON (N.oid = C.relnamespace)
  WHERE C.relkind = 'S' AND C.relname IN ('test_target_id_seq', 'test_target2_id_seq', 'test_target3_id_seq'
                                         ,'provsub_id_seq', 'test_synchronize_id_seq')
  ORDER BY 1, 2;
    schemaname     |        tablename        | synced 
-------------------+-------------------------+--------
 provsub           | test_target3_id_seq     | t
 subscriber.pong   | provsub_id_seq          | t
 subscriber.pong   | test_synchronize_id_seq | t
 subscriber.pong   | test_target_id_seq      | t
 subscriber2.pong2 | test_target2_id_seq     | t
(5 rows)

-- show and cleaning
\c :subscriber_dsn
SELECT * FROM pglogical.show_subscription_status('sub_map1');
 subscription_name |   status    | provider_node |         provider_dsn         |              slot_name              | replication_sets | forward_origins 
-------------------+-------------+---------------+------------------------------+-------------------------------------+------------------+-----------------
 sub_map1          | replicating | test_provider | dbname=regression user=super | pgl_postgres_test_provider_sub_map1 | {map1}           | 
(1 row)

SELECT * FROM pglogical.show_subscription_table('sub_map1','"subscriber.pong".test_target');
     nspname     |   relname   |   status    
-----------------+-------------+-------------
 subscriber.pong | test_target | replicating
(1 row)

--- XXX add more here
SELECT * FROM pglogical.show_subscription_status('sub_map2');
 subscription_name |   status    | provider_node |         provider_dsn         |              slot_name              | replication_sets | forward_origins 
-------------------+-------------+---------------+------------------------------+-------------------------------------+------------------+-----------------
 sub_map2          | replicating | test_provider | dbname=regression user=super | pgl_postgres_test_provider_sub_map2 | {map2}           | 
(1 row)

SELECT * FROM pglogical.drop_subscription('sub_map1');
 drop_subscription 
-------------------
                 1
(1 row)

SELECT * FROM pglogical.drop_subscription('sub_map2');
 drop_subscription 
-------------------
                 1
(1 row)

\c :provider_dsn
SELECT nspname, relname, att_list, has_row_filter, nsptarget, reltarget
FROM pglogical.show_repset_table_info_by_target('subscriber.pong','test_target', ARRAY['map1','map2']) order by 1,2;
    nspname    |   relname   | att_list  | has_row_filter |    nsptarget    |  reltarget  
---------------+-------------+-----------+----------------+-----------------+-------------
 provider.ping | test_merge  | {id,data} | f              | subscriber.pong | test_target
 provider.ping | test_origin | {id,data} | f              | subscriber.pong | test_target
(2 rows)

-- XXX fonction pglogical.table_data_filtered(anyelement,regclass,text[]) ?
SELECT * FROM pglogical.replication_set_seq order by 1,2;
   set_id   |               set_seqoid                |   set_nsptarget   |      set_seqtarget      
------------+-----------------------------------------+-------------------+-------------------------
 1072520286 | "provider.ping".test_origin_id_seq      | subscriber2.pong2 | test_target2_id_seq
 2047405990 | "provider.ping".test_origin_id_seq      | subscriber.pong   | test_target_id_seq
 2047405990 | provsub.test_origin3_id_seq             | provsub           | test_target3_id_seq
 2047405990 | "provider.ping".provsub_id_seq          | subscriber.pong   | provsub_id_seq
 2047405990 | "provider.ping".test_synchronize_id_seq | subscriber.pong   | test_synchronize_id_seq
(5 rows)

SELECT * FROM pglogical.replication_set_table order by 1,2;
   set_id   |            set_reloid            | set_att_list | set_row_filter |   set_nsptarget   |  set_reltarget   
------------+----------------------------------+--------------+----------------+-------------------+------------------
 1072520286 | "provider.ping".test_origin      |              |                | subscriber2.pong2 | test_target2
 1072520286 | "provider.ping".test_merge       |              |                | subscriber.pong   | test_target
 2047405990 | "provider.ping".test_origin      |              |                | subscriber.pong   | test_target
 2047405990 | provsub.test_origin3             |              |                | provsub           | test_target3
 2047405990 | "provider.ping".provsub          |              |                | subscriber.pong   | provsub
 2047405990 | "provider.ping".test_synchronize |              |                | subscriber.pong   | test_synchronize
(6 rows)

SELECT cache_size,last_value FROM pglogical.sequence_state;
 cache_size | last_value 
------------+------------
       1000 |       1005
       1000 |       1004
       1000 |       1004
       1000 |       1001
(4 rows)

SELECT * FROM pglogical.drop_replication_set('map1');
 drop_replication_set 
----------------------
 t
(1 row)

SELECT * FROM pglogical.drop_replication_set('map2');
 drop_replication_set 
----------------------
 t
(1 row)

DROP SCHEMA "provider.ping" CASCADE;
NOTICE:  drop cascades to 5 other objects
DETAIL:  drop cascades to table "provider.ping".test_origin
drop cascades to table "provider.ping".test_origin2
drop cascades to table "provider.ping".provsub
drop cascades to table "provider.ping".test_synchronize
drop cascades to table "provider.ping".test_merge
DROP SCHEMA "provider2.ping2" CASCADE;
DROP SCHEMA provsub CASCADE;
NOTICE:  drop cascades to table provsub.test_origin3
\c :subscriber_dsn
DROP SCHEMA "subscriber.pong" CASCADE;
NOTICE:  drop cascades to 4 other objects
DETAIL:  drop cascades to table "subscriber.pong".test_target
drop cascades to table "subscriber.pong".provsub
drop cascades to table "subscriber.pong".test_synchronize
drop cascades to table "subscriber.pong".test_merge
DROP SCHEMA "subscriber2.pong2" CASCADE;
NOTICE:  drop cascades to table "subscriber2.pong2".test_target2
DROP SCHEMA provsub CASCADE;
NOTICE:  drop cascades to table provsub.test_target3
